Name,Category,Subcategory,Price,Description,CPU,RAM,Storage
ProBook Enterprise 450 G9,Laptop,Corporate Laptops,Contact for Price,Enterprise-grade laptop designed for corporate environments with advanced security features and reliable performance.,Intel Core i7-12th Gen,16GB DDR4,512GB NVMe SSD
Dell Latitude 5530,Laptop,Corporate Laptops,"$1,499",Premium business laptop with exceptional performance and enterprise-class security.,Intel Core i7-12th Gen,32GB DDR4,1TB SSD
ROG Strix G15,Laptop,Gaming Laptops,"$1,799",High-performance gaming laptop for creative professionals and gaming enthusiasts.,AMD Ryzen 9 6900HX,32GB DDR5,1TB NVMe SSD
EliteBook 840 G9,Laptop,Business Laptops,"$1,199",Sleek and powerful laptop for modern business professionals on the go.,Intel Core i5-12th Gen,16GB DDR5,512GB SSD
ThinkPad T14 Gen 3,Laptop,Corporate Laptops,"$1,299",Legendary ThinkPad reliability meets modern performance for business professionals.,Intel Core i5-12th Gen,16GB DDR4,256GB SSD
HP ProBook 450 G10,Laptop,Business Laptops,$999,Affordable business laptop with solid performance for everyday tasks.,Intel Core i5-13th Gen,8GB DDR4,256GB SSD
